{
  "id": "troens-bonn",
  "slug": "troens-bonn",
  "url": "/kristenliv/bonn/troens-bonn/",
  "title": "Troens bønn",
  "subtitle": "En bibelsk studie av hva troens bønn er, hvordan tro vokser frem, og hvordan den troende kan be med frimodighet etter Guds vilje.",
  "category": "Bønn",
"categoryUrl": "/kristenliv/bonn/",
  "tags": [
    "bønn",
    "tro",
    "troens bønn",
    "Jakob 5",
    "bibelstudie"
  ],
  "author": "THEOLOGIA",
  "authorPhoto": "/images/forfattere/standard.jpg",
  "authorBio": "THEOLOGIA er et digitalt bibliotek med bibelstudier og teologiske ressurser.",
  "date": "2026-08-04",
  "updated": "2026-08-04",
  "heroImage": "/images/artikler/troens-bonn-hero.jpg",
  "metaDescription": "En bibelsk studie av troens bønn med utgangspunkt i Jakob 5,15 og sentrale skriftsteder om tro, bønn og Guds vilje.",

  "asideTitle": "Om denne artikkelen",
  "asideContent": "En studie av hva Bibelen lærer om troens bønn, troens grunnlag, Guds vilje og et liv i tillit til Gud.",

  "introduction": "Uttrykket «troens bønn» finner vi i Jakob 5,15. Dette verset fremhever en kraftfull dimensjon ved bønn – bønn som er gjennomsyret av tro. Denne artikkelen undersøker hva troens bønn innebærer, hvordan tro oppstår, og hvordan vi kan be i tro basert på Guds Ord.",

  "sections": [
    {
      "id": "innledning",
      "heading": "Troens bønn",
      "content": "Uttrykket «troens bønn» finner vi i Jakob 5,15: «Og troens bønn skal redde den syke, og Herren skal reise ham opp. Og har han gjort synder, skal de bli ham tilgitt.» Dette verset fremhever at bønn ikke bare handler om ord, men om en bønn som er gjennomsyret av tro. Jesus sier også: «Og alt dere ber om i bønn, skal dere få, dersom dere tror.» Tro er derfor en avgjørende faktor i bønnelivet.",
      "scriptures": [
        {
          "reference": "Jakob 5,15",
          "text": "Og troens bønn skal redde den syke, og Herren skal reise ham opp. Og har han gjort synder, skal de bli ham tilgitt.",
          "translation": "Bibelen – Guds Ord"
        },
        {
          "reference": "Matteus 21,22",
          "text": "Og alt dere ber om i bønn, skal dere få, dersom dere tror.",
          "translation": "Bibelen – Guds Ord"
        }
      ]
    },

    {
      "id": "grunnlaget-for-tro",
      "heading": "Grunnlaget for tro",
      "content": "Tro i bønn springer ikke ut av et blindt håp, men fra en forankret tillit til Gud. Denne tilliten bygger på kunnskap om hvem Gud er, hans karakter, hans løfter og hans vilje slik den er åpenbart i Bibelen. Når Guds Ord bor i oss, styrkes troen, og vi lærer å be i tråd med hans hjerte.",
      "scriptures": [
        {
          "reference": "Johannes 15,7",
          "text": "Dersom dere blir i meg og mine ord blir i dere, be om hva dere vil, og dere skal få det.",
          "translation": "Bibelen – Guds Ord"
        }
      ],
      "subsections": [
        {
          "heading": "Kunnskap om Gud og hans Ord",
          "content": "Troens bønn begynner med å kjenne Gud. Bibelsk tro er ikke basert på usikkerhet eller menneskelige følelser, men på det Gud har åpenbart gjennom sitt Ord. Når vi kjenner Gud, lærer vi også hans vilje å kjenne."
        },
        {
          "heading": "Tillit til Guds godhet og makt",
          "content": "Troens bønn forutsetter tillit til at Gud er en god Far som ønsker å gi gode gaver til sine barn, og at han har makt til å oppfylle sine løfter.",
          "scriptures": [
            {
              "reference": "Matteus 7,11",
              "text": "Hvor mye mer skal ikke da deres Far i himmelen gi gode gaver til dem som ber ham.",
              "translation": "Bibelen – Guds Ord"
            }
          ]
        }
      ]
    },

    {
      "id": "guds-vilje",
      "heading": "Bønn i tråd med Guds vilje",

      "content": "Troens bønn betyr ikke at mennesket forsøker å få Gud til å gjøre det vi ønsker. Bibelsk bønn er en tillitsfull respons på Guds karakter og hans åpenbarte vilje. Når vi kjenner Gud gjennom hans Ord, lærer vi også hva vi kan be om med frimodighet.",

      "scriptures": [
        {
          "reference": "1 Johannes 5,14-15",
          "text": "Og dette er frimodigheten vi har for ham, at dersom vi ber om noe som er etter hans vilje, så hører han oss. Og når vi vet at han hører oss, hva vi enn ber om, da vet vi at vi har fått det vi har bedt ham om.",
          "translation": "Bibelen – Guds Ord"
        },
        {
          "reference": "Jakob 1,5",
          "text": "Om noen av dere mangler visdom, skal han be til Gud, som gir til alle, villig og uten å bebreide, og han skal få.",
          "translation": "Bibelen – Guds Ord"
        }
      ],

      "subsections": [
        {
          "heading": "Å kjenne Guds vilje gjennom Ordet",

          "content": "Gud har ikke overlatt oss uten veiledning. Gjennom Bibelen lærer vi hans karakter, hans løfter og hans hensikt. Troens bønn bygger derfor ikke på usikkerhet, men på tillit til det Gud har sagt."
        },

        {
          "heading": "Frimodighet i bønn",

          "content": "Når vi ber etter Guds vilje, kan vi komme til ham med frimodighet. Vissheten om at Gud hører bønnene våre bygger ikke på menneskets styrke, men på Guds trofasthet."
        }
      ]
    },

    {
      "id": "rene-motiver",
      "heading": "Rene motiver",

      "content": "Troens bønn handler ikke bare om hva vi ber om, men også om hvorfor vi ber. Jakob advarer mot bønn som springer ut fra egoistiske ønsker. Bibelsk bønn søker først Guds ære og hans rike.",

      "scriptures": [
        {
          "reference": "Jakob 4,3",
          "text": "Dere ber og får ikke, fordi dere ber galt, for å sløse det bort i deres lyster.",
          "translation": "Bibelen – Guds Ord"
        }
      ],

      "infoBoxes": [
        {
          "type": "important",
          "title": "Bønnens motiv",
          "text": "Troens bønn handler ikke om å bruke Gud for å oppnå egne ønsker. Den springer ut fra et hjerte som ønsker å følge Guds vilje."
        }
      ]
    },

    {
      "id": "kampen-mot-tvil",
      "heading": "Kampen mot tvil",

      "content": "Tvil kan utfordre den troendes bønneliv. Bibelen oppmuntrer oss til å holde fast ved Gud selv når omstendighetene er vanskelige. Tro betyr ikke at vi aldri møter kamp, men at vi fortsetter å stole på Gud.",

      "scriptures": [
        {
          "reference": "Jakob 1,6-8",
          "text": "Men han må be i tro, uten å tvile. For den som tviler, er lik en bølge på havet som drives og kastes hit og dit.",
          "translation": "Bibelen – Guds Ord"
        }
      ]
    },

        {
      "id": "naert-forhold-til-jesus",
      "heading": "Et nært forhold til Jesus",

      "content": "Troens bønn er uløselig knyttet til et levende forhold til Jesus Kristus. Bønn er ikke bare en handling vi utfører, men et uttrykk for fellesskap med Gud. Når vi blir i Kristus og lar hans Ord bli i oss, formes våre tanker, ønsker og bønner.",

      "scriptures": [
        {
          "reference": "Johannes 15,7",
          "text": "Hvis dere blir i meg og mine ord blir i dere, be da om hva dere vil, og dere skal få det.",
          "translation": "Bibelen – Guds Ord"
        },
        {
          "reference": "Johannes 15,5",
          "text": "Jeg er vintreet, dere er grenene. Den som blir i meg og jeg i ham, bærer mye frukt. For uten meg kan dere ingen ting gjøre.",
          "translation": "Bibelen – Guds Ord"
        }
      ],

      "subsections": [
        {
          "heading": "Bønn som fellesskap med Gud",

          "content": "Det kristne bønnelivet bygger på forholdet mellom Gud og hans barn. Gjennom Jesus Kristus har vi fått adgang til Gud, og vi kan komme frem for ham med frimodighet."
        },

        {
          "heading": "Et liv som søker Gud",

          "content": "Troens bønn vokser frem fra et liv som stadig søker Gud. Når hjertet er vendt mot Herren, blir bønn en naturlig del av fellesskapet med ham."
        }
      ]
    },

    {
      "id": "definisjon-av-tro",
      "heading": "Hva er tro?",

      "content": "For å forstå troens bønn må vi forstå hva Bibelen mener med tro. Tro er ikke bare en positiv tanke eller en sterk følelse. Bibelsk tro er en fast tillit til Gud som bygger på hans karakter og hans løfter.",

      "scriptures": [
        {
          "reference": "Hebreerne 11,1",
          "text": "Troen er sikkerhet for det som håpes, visshet om ting en ikke ser.",
          "translation": "Bibelen – Guds Ord"
        }
      ],

      "subsections": [
        {
          "heading": "Tro er visshet",

          "content": "Tro gir en indre overbevisning om at Gud er trofast. Den troende holder fast ved Guds løfter fordi Gud selv er pålitelig."
        },

        {
          "heading": "Tro er overbevisning om det usynlige",

          "content": "Tro handler om å stole på Guds virkelighet selv om alt ikke kan sees med menneskelige øyne. Den bygger på Guds åpenbaring, ikke på menneskets begrensede forståelse."
        }
      ],

      "infoBoxes": [
        {
          "type": "important",
          "title": "Bibelsk tro",

          "text": "Tro er ikke å tro på noe uten grunnlag. Tro er å stole på Gud fordi han har åpenbart seg som trofast og sann."
        }
      ]
    },

    {
      "id": "tro-pa-guds-ord",
      "heading": "Tro på Guds Ord",

      "content": "Troens grunnlag er Guds Ord. Den kristne troen bygger ikke først og fremst på følelser, erfaringer eller menneskelige vurderinger, men på det Gud har sagt.",

      "scriptures": [
        {
          "reference": "Romerne 10,17",
          "text": "Så kommer da troen av forkynnelsen, og forkynnelsen ved Kristi ord.",
          "translation": "Bibelen – Guds Ord"
        },
        {
          "reference": "2 Timoteus 3,16",
          "text": "Hver bok i Skriften er innblåst av Gud og nyttig til opplæring, tilrettevisning, veiledning og oppdragelse i rettferdighet.",